{
  "$schema": "https://json-schema.org/draft/2020-12/schema",
  "$id": "https://falak.sh/agent-protocol/commands/docker.compose.up.schema.json",
  "title": "docker.compose.up \u2014 docker compose up -d for a project (optionally waiting for healthy services)",
  "type": "object",
  "additionalProperties": false,
  "required": [
    "project",
    "directory"
  ],
  "properties": {
    "project": {
      "type": "string",
      "pattern": "^[a-z0-9][a-z0-9_-]*$"
    },
    "directory": {
      "type": "string",
      "pattern": "^/"
    },
    "files": {
      "type": "array",
      "items": {
        "type": "object",
        "additionalProperties": false,
        "required": [
          "name",
          "content"
        ],
        "properties": {
          "name": {
            "type": "string",
            "pattern": "^[A-Za-z0-9_.-]+$"
          },
          "content": {
            "type": "string"
          }
        }
      },
      "description": "Written into directory before running; compose files are passed with -f in order. .env* files are written 0600 and not passed with -f."
    },
    "assets": {
      "type": "array",
      "maxItems": 200,
      "description": "Repository files the project mounts or reads, written to <directory>/repo/<path> (agent feature compose.v2).",
      "items": {
        "type": "object",
        "additionalProperties": false,
        "required": [
          "path",
          "content"
        ],
        "properties": {
          "path": {
            "type": "string",
            "maxLength": 512,
            "pattern": "^(?:[^./\\\\\\x00-\\x1f\\x7f][^/\\\\\\x00-\\x1f\\x7f]*|\\.[^./\\\\\\x00-\\x1f\\x7f][^/\\\\\\x00-\\x1f\\x7f]*|\\.\\.[^/\\\\\\x00-\\x1f\\x7f]+)(?:/(?:[^./\\\\\\x00-\\x1f\\x7f][^/\\\\\\x00-\\x1f\\x7f]*|\\.[^./\\\\\\x00-\\x1f\\x7f][^/\\\\\\x00-\\x1f\\x7f]*|\\.\\.[^/\\\\\\x00-\\x1f\\x7f]+))*$"
          },
          "content": {
            "type": "string",
            "contentEncoding": "base64"
          },
          "mode": {
            "type": "integer",
            "enum": [
              420,
              493
            ]
          }
        }
      }
    },
    "env": {
      "type": "object",
      "propertyNames": {
        "pattern": "^[A-Za-z_][A-Za-z0-9_]*$"
      },
      "additionalProperties": {
        "type": "string"
      },
      "description": "Process environment of the compose CLI (interpolation)"
    },
    "pull": {
      "enum": [
        "always",
        "missing",
        "never"
      ],
      "default": "missing"
    },
    "remove_orphans": {
      "type": "boolean",
      "default": true
    },
    "wait": {
      "type": "boolean",
      "default": false,
      "description": "--wait: block until services are running/healthy; fails when one is unhealthy or exits"
    },
    "wait_timeout_s": {
      "type": "integer",
      "minimum": 1,
      "maximum": 3600,
      "description": "--wait-timeout"
    },
    "project_env_file": {
      "type": "string",
      "pattern": "^[A-Za-z0-9_.-]+$",
      "description": "File in directory passed as --env-file (e.g. .env)"
    },
    "registry_auth": {
      "type": "object",
      "additionalProperties": false,
      "required": [
        "username",
        "password"
      ],
      "properties": {
        "username": {
          "type": "string"
        },
        "password": {
          "type": "string"
        },
        "server": {
          "type": "string"
        }
      },
      "description": "Registry credentials for pulls (written to a throwaway DOCKER_CONFIG for the command)"
    },
    "services": {
      "type": "array",
      "maxItems": 100,
      "items": {
        "type": "string",
        "pattern": "^[a-zA-Z0-9][a-zA-Z0-9_.-]*$"
      },
      "description": "Only start these services and what they depend on (feature compose.up.services; default: all). A stack's bootstrap pass starts the services its split-out sites use."
    },
    "mask": {
      "type": "array",
      "items": {
        "type": "string",
        "pattern": "^[A-Za-z_][A-Za-z0-9_]*$"
      },
      "uniqueItems": true,
      "description": "Names of the secret variables in this payload. The agent looks their values up in the payload (env maps, dotenv content) and masks them, plus their base64 and URL-encoded forms, as \u2022\u2022\u2022\u2022 in the command's output, error and result. Values shorter than 6 bytes are not masked."
    },
    "join_networks": {
      "type": "array",
      "maxItems": 4,
      "uniqueItems": true,
      "items": {
        "type": "string",
        "pattern": "^falak-env-[0-9a-z]{26}$"
      },
      "description": "feature db.instances: environment networks every container of the project joins after `up` (created when missing, labels falak.managed / falak.network=environment), where the environment's databases answer by name"
    }
  },
  "$defs": {
    "result": {
      "type": "object",
      "additionalProperties": false,
      "required": [
        "exit_code"
      ],
      "properties": {
        "exit_code": {
          "type": "integer"
        },
        "services": {
          "type": "array",
          "items": {
            "$ref": "#/$defs/service"
          },
          "description": "Every container of the project after up (also on failure)"
        }
      }
    },
    "service": {
      "type": "object",
      "additionalProperties": false,
      "required": [
        "service",
        "container_id",
        "state",
        "image",
        "restarts"
      ],
      "properties": {
        "service": {
          "type": "string"
        },
        "container_id": {
          "type": "string"
        },
        "container_name": {
          "type": "string"
        },
        "state": {
          "type": "string",
          "description": "created|running|restarting|paused|exited|dead"
        },
        "health": {
          "type": "string",
          "description": "healthy|unhealthy|starting (absent without a healthcheck)"
        },
        "exit_code": {
          "type": "integer"
        },
        "image": {
          "type": "string"
        },
        "image_digest": {
          "type": "string",
          "pattern": "^sha256:[a-f0-9]{64}$"
        },
        "ports": {
          "type": "array",
          "items": {
            "$ref": "#/$defs/port"
          }
        },
        "restarts": {
          "type": "integer",
          "minimum": 0
        },
        "started_at": {
          "type": "string"
        },
        "cpu_percent": {
          "type": "number",
          "minimum": 0
        },
        "memory_bytes": {
          "type": "integer",
          "minimum": 0
        },
        "memory_limit_bytes": {
          "type": "integer",
          "minimum": 0
        }
      }
    },
    "port": {
      "type": "object",
      "additionalProperties": false,
      "required": [
        "container_port",
        "protocol"
      ],
      "properties": {
        "host_ip": {
          "type": "string"
        },
        "host_port": {
          "type": "integer",
          "minimum": 0,
          "maximum": 65535
        },
        "container_port": {
          "type": "integer",
          "minimum": 0,
          "maximum": 65535
        },
        "protocol": {
          "type": "string"
        }
      }
    }
  }
}
