{
  "project": "shop",
  "directory": "/srv/falak/sites/shop/releases/01J9ZQ4N8V2M6R0T3W5Y7B9D1F",
  "files": [
    {
      "name": "compose.yaml",
      "content": "services:\n  app:\n    image: registry.falak.local/falak/shop/app@sha256:3f1c9a0e4b5d6c7e8f9a0b1c2d3e4f5a6b7c8d9e0f1a2b3c4d5e6f7a8b9c0d1e\n    ports: [\"127.0.0.1:3001:8080\"]\n    labels: {falak.site: shop, falak.release: 01J9ZQ4N8V2M6R0T3W5Y7B9D1F, falak.service: app}\n"
    },
    {
      "name": ".env",
      "content": "APP_KEY=secret\nFALAK_SITE_ID=01J9ZQ4N8V2M6R0T3W5Y7B9D1A\n"
    }
  ],
  "project_env_file": ".env",
  "pull": "missing",
  "remove_orphans": true,
  "wait": true,
  "wait_timeout_s": 120,
  "registry_auth": {
    "server": "registry.falak.local",
    "username": "falak",
    "password": "s3cret"
  },
  "mask": [
    "DB_PASSWORD"
  ],
  "join_networks": ["falak-env-01hzyenv000000000000000001"]
}
